{
    "organization": "reaver-project",
    "profile": {
        "default_repository_permission": "read",
        "deploy_keys_enabled_for_repositories": false,
        "members_can_create_private_repositories": false,
        "members_can_create_public_repositories": false,
        "members_can_create_repositories": false,
        "web_commit_signoff_required": false
    },
    "actions": {
        "allowed_actions": "selected",
        "artifact_and_log_retention_days": 30,
        "can_approve_pull_request_reviews": false,
        "default_workflow_permissions": "read",
        "enabled_repositories": "all",
        "github_owned_allowed": true,
        "patterns_allowed": [
            "aws-actions/configure-aws-credentials@*",
            "astral-sh/setup-uv@*",
            "ossf/scorecard-action@*",
            "step-security/harden-runner@*",
            "zizmorcore/zizmor-action@*",
            "reaver-project/infrastructure/actions/*@*"
        ],
        "sha_pinning_required": true,
        "verified_allowed": false
    },
    "packages": {
        "inherit_access_from_source_repository": false,
        "member_creation": {
            "public": false,
            "private": false,
            "internal": false
        }
    },
    "code_security": {
        "attachment_scope": "all",
        "default_for_new_repositories": "all",
        "configuration": {
            "name": "Reaver Project security baseline",
            "description": "Enforced dependency, code scanning, and secret protection defaults for Reaver Project repositories.",
            "code_security": "enabled",
            "dependency_graph": "enabled",
            "dependency_graph_autosubmit_action": "disabled",
            "dependency_graph_autosubmit_action_options": {
                "labeled_runners": false
            },
            "dependabot_alerts": "enabled",
            "dependabot_security_updates": "disabled",
            "dependabot_delegated_alert_dismissal": "disabled",
            "code_scanning_default_setup": "enabled",
            "code_scanning_default_setup_options": {
                "runner_type": "standard",
                "runner_label": null
            },
            "code_scanning_options": {
                "allow_advanced": true
            },
            "code_scanning_delegated_alert_dismissal": "disabled",
            "secret_protection": "enabled",
            "secret_scanning": "enabled",
            "secret_scanning_push_protection": "enabled",
            "secret_scanning_delegated_bypass": "disabled",
            "secret_scanning_validity_checks": "enabled",
            "secret_scanning_non_provider_patterns": "enabled",
            "secret_scanning_generic_secrets": "enabled",
            "secret_scanning_delegated_alert_dismissal": "disabled",
            "secret_scanning_extended_metadata": "enabled",
            "private_vulnerability_reporting": "enabled",
            "enforcement": "enforced"
        }
    },
    "manual_controls": [
        "Require two-factor authentication for every organization member.",
        "Keep at least two independently stored owner recovery methods.",
        "Restrict member repository deletion and visibility changes in the organization settings.",
        "Retain break-glass AWS and GitHub credentials outside GitHub Actions."
    ]
}
